<?xml version="1.0" encoding="UTF-8"?>
<!--Sample XML file generated by XMLSpy v2008 sp1 (http://www.altova.com)-->
<bks:Books xsi:schemaLocation="http://www.dummy.org/booksXml Books_v1.0.0.xsd" xmlns:bks="http://www.dummy.org/booksXml" xmlns:xsi="http://www.w3.org/2001/XMLSchema-instance">
	<bks:Book bookId="001">
		<bks:ISBN>978-1-2345-6789-0</bks:ISBN>
		<bks:Writer>
			<bks:Author>John Doe</bks:Author>
			<bks:Address>
				<bks:BuildingHouseNumber>123</bks:BuildingHouseNumber>
				<bks:StreetName>StreetName1</bks:StreetName>
				<bks:CityName>CityName1</bks:CityName>
				<bks:StateProvince>StateProvince1</bks:StateProvince>
				<bks:PostalCode>12345</bks:PostalCode>
			</bks:Address>
		</bks:Writer>
		<bks:Title>My interesting life</bks:Title>
		<bks:Genre>Biography</bks:Genre>
		<bks:Price currency="euros">9.99</bks:Price>
		<bks:Publisher>
			<bks:PublisherName>PublishersName11</bks:PublisherName>
			<bks:Address>
				<bks:POBoxNumber>12345</bks:POBoxNumber>
				<bks:BuildingHouseNumber>231</bks:BuildingHouseNumber>
				<bks:StreetName>StreetName11</bks:StreetName>
				<bks:CityName>CityName11</bks:CityName>
				<bks:StateProvince>StateProvince11</bks:StateProvince>
				<bks:PostalCode>11345</bks:PostalCode>
			</bks:Address>
			<bks:Regions>
				<bks:Region>Africa</bks:Region>
				<bks:Region>Europe</bks:Region>
			</bks:Regions>
		</bks:Publisher>
		<bks:Publisher>
			<bks:PublisherName>PublishersName12</bks:PublisherName>
			<bks:Address>
				<bks:POBoxNumber>23451</bks:POBoxNumber>
				<bks:BuildingHouseNumber>312</bks:BuildingHouseNumber>
				<bks:StreetName>StreetName12</bks:StreetName>
				<bks:CityName>CityName12</bks:CityName>
				<bks:StateProvince>StateProvince12</bks:StateProvince>
				<bks:PostalCode>12345</bks:PostalCode>
			</bks:Address>
			<bks:Regions>
				<bks:Region>Asia</bks:Region>
			</bks:Regions>
		</bks:Publisher>
		<bks:PublishingDate>2019-01-01</bks:PublishingDate>
		<bks:Review>Very, very good</bks:Review>
	</bks:Book>
	<bks:Book bookId="002">
		<bks:ISBN>978-2-3456-7890-1</bks:ISBN>
		<bks:Writer>
			<bks:Author>Jane Whats Her Name</bks:Author>
			<bks:Address>
				<bks:BuildingHouseNumber>456</bks:BuildingHouseNumber>
				<bks:StreetName>StreetName2</bks:StreetName>
				<bks:CityName>CityName2</bks:CityName>
				<bks:StateProvince>StateProvince2</bks:StateProvince>
				<bks:PostalCode>23456</bks:PostalCode>
			</bks:Address>
		</bks:Writer>
		<bks:Title>My favorite destinations</bks:Title>
		<bks:Genre>Travel</bks:Genre>
		<bks:Price currency="euros">19.99</bks:Price>
		<bks:Publisher>
			<bks:PublisherName>PublishersName21</bks:PublisherName>
			<bks:Address>
				<bks:POBoxNumber>23451</bks:POBoxNumber>
				<bks:BuildingHouseNumber>456</bks:BuildingHouseNumber>
				<bks:StreetName>StreetName21</bks:StreetName>
				<bks:CityName>CityName21</bks:CityName>
				<bks:StateProvince>StateProvince21</bks:StateProvince>
				<bks:PostalCode>22345</bks:PostalCode>
			</bks:Address>
			<bks:Regions>
				<bks:Region>America</bks:Region>
				<bks:Region>Europe</bks:Region>
			</bks:Regions>
		</bks:Publisher>
		<bks:Publisher>
			<bks:PublisherName>PublishersName12</bks:PublisherName>
			<bks:Address>
				<bks:POBoxNumber>23451</bks:POBoxNumber>
				<bks:BuildingHouseNumber>312</bks:BuildingHouseNumber>
				<bks:StreetName>StreetName12</bks:StreetName>
				<bks:CityName>CityName12</bks:CityName>
				<bks:StateProvince>StateProvince12</bks:StateProvince>
				<bks:PostalCode>12345</bks:PostalCode>
			</bks:Address>
			<bks:Regions>
				<bks:Region>Asia</bks:Region>
			</bks:Regions>
		</bks:Publisher>
		<bks:PublishingDate>2019-02-02</bks:PublishingDate>
		<bks:Review>Very, very interesting</bks:Review>
	</bks:Book>
</bks:Books>
